{
  "name": "extractor-numeric",
  "created_at": "2026-07-14T08:30:00Z",
  "input_type": "examples",
  "examples_count": 3,
  "rules_provided": false,
  "mode_binding": "brief",
  "has_template": false,
  "jurisdictions": ["CY"],
  "language": "en",
  "confidence": 0.85,
  "summary": "Numeric confidence as written by the unchanged v1 style-extractor (D-16)."
}
