{
  "name": "my-firm",
  "created_at": "2026-07-14T08:30:00Z",
  "input_type": "both",
  "examples_count": 4,
  "rules_provided": true,
  "has_template": true,
  "jurisdictions": [
    "EU",
    "CY"
  ],
  "language": "en",
  "confidence": "high",
  "summary": "Conclusion-first house style with numbered risk lines."
}
